{
  "admission": {
    "membership": {
      "curated": false,
      "historical_public_export": false
    },
    "reasons": [
      "NOT_PRIMARY_CONCRETE_DEFINITION",
      "SECONDARY_TRANSCRIPTION"
    ],
    "scope": "Existing definition admission only; not economic validity, execution readiness or commercial clearance.",
    "status": "REVIEW_REQUIRED"
  },
  "category": "unclassified",
  "definition": {
    "content_origin": "PROJECT_AUTHORED_STRUCTURAL_SUMMARY",
    "definition_sha256": "ce0120e74c83f6c54b498513f7cb356a9bbb695a35c7976e8dc14442ce15af0b",
    "formula": null,
    "formula_dialect": "wq101",
    "formula_sha256": "ce0120e74c83f6c54b498513f7cb356a9bbb695a35c7976e8dc14442ce15af0b",
    "hash_scope": "SHA-256 of the original collected field UTF-8, before excerpting; null means absent.",
    "parameters": {
      "alpha_number": 80,
      "numeric_literals": [
        "0.868128",
        "1",
        "4.04545",
        "5.11456",
        "5.53756"
      ],
      "operators": [
        "wq101:corr",
        "wq101:cs_rank",
        "wq101:delta",
        "wq101:industry_neutralize",
        "wq101:sign",
        "wq101:ts_rank"
      ],
      "source_commented_out": false
    },
    "required_fields": [
      "adv10",
      "high",
      "indclass.industry",
      "open"
    ],
    "required_fields_status": "syntax_extracted_unexpanded",
    "status": "STRUCTURED_SUMMARY_ONLY",
    "text": "已有结构化提取记录列出输入：adv10、high、indclass.industry、open；算子：wq101:corr、wq101:cs_rank、wq101:delta、wq101:industry_neutralize、wq101:sign、wq101:ts_rank；数值字面量：0.868128、1、4.04545、5.11456、5.53756。这些构成要素不保留完整运算顺序，也不证明计算语义。完整定义须按来源定位核对。",
    "truncated": false
  },
  "domain": {
    "asset_class": "equity",
    "frequency": "daily",
    "holding_period": null,
    "lookback": null,
    "rebalance": null,
    "universe": "requires caller-specified cross-sectional equity universe"
  },
  "entity_type": "factor",
  "identity": {
    "curated_canonical_factor_id": null,
    "equivalence_scope": "Existing exact-variant identity only; no new cross-source or economic-concept equivalence asserted.",
    "legacy_canonical_factor_ids": [
      "qkg:factor:fb7758a2-dfed-5a53-8c49-87fb78d737c8"
    ],
    "normalized_canonical_factor_ids": [
      "qkg:concept:5631679a-15c6-519e-955d-204df897e479"
    ],
    "normalized_concept_ids": [
      "qkg:concept:5631679a-15c6-519e-955d-204df897e479"
    ],
    "source_record_ids": [
      "qkg:record:1cd68606-ad86-50f6-a0da-5941b9a5ccac"
    ]
  },
  "identity_namespace": "quantgraph/factor-variant",
  "missing_information": [
    "现有采集未验证计算语义；不代表已复现、可回测或具有收益有效性。",
    "行情供应商、历史可用时点、复权、缺失处理和实际组合交易规则尚未冻结。",
    "底层行情、原论文和研报授权分别核验，不从仓库代码许可推定。",
    "社区转录不证明原始公式权利；不复制完整公式，仅保留结构要素、摘要及原字段摘要。"
  ],
  "name": "WorldQuant Alpha080",
  "native_source_ids": [
    "alpha080"
  ],
  "provenance": {
    "exporter": "factor-metadata-export/v1",
    "line_hash_scope": "Original UTF-8 JSONL line bytes, excluding the line terminator.",
    "source_artifact": "normalized/factor_records.jsonl",
    "source_lines": [
      {
        "line_bytes": 5784,
        "line_ordinal": 1351,
        "line_sha256": "177b263ad164a7b4abb7653a43220b32db1035705aac7c5b8cb2d4e440dbbfd8",
        "record_id": "qkg:record:1cd68606-ad86-50f6-a0da-5941b9a5ccac"
      }
    ],
    "source_snapshot_sha256": "58772a1fa216e8c26df4a049a1f7f818e6557bd648e2c53d971e5ba904835686"
  },
  "quality": {
    "backtest_ready": false,
    "economic_validity": "NOT_EVALUATED",
    "metadata_status": "IMPORTED_TRACEABLE_METADATA",
    "parse_status": [
      "parsed"
    ],
    "semantic_status": [
      "not_verified"
    ],
    "source_quality_tiers": [
      "secondary_definition"
    ],
    "upstream_code_executed_in_export": false
  },
  "record_id": "qkg:factor:fb7758a2-dfed-5a53-8c49-87fb78d737c8",
  "record_kind": "signal",
  "rights": {
    "attribution_required": false,
    "commercial_use": [
      "REVIEW_REQUIRED"
    ],
    "derivative_allowed": [
      "REVIEW_REQUIRED"
    ],
    "license_labels": [
      "MIT (community repository); upstream formula/paper rights not cleared"
    ],
    "license_notice": "README.md 中说明逐来源归属与限制；原状态保留，不因进入统一目录而放宽商业许可。",
    "market_observations_included": false,
    "raw_data_allowed": [
      "REVIEW_REQUIRED"
    ],
    "redistribution_allowed": [
      "REVIEW_REQUIRED"
    ],
    "scope": "Directory metadata and expressly identified definition excerpts only; no blanket license over upstream papers, source implementations or market observations.",
    "source_fulltext_included": false
  },
  "schema_version": "quantgraph-factor-metadata/v1",
  "sources": [
    {
      "admission": {
        "reasons": [
          "NOT_PRIMARY_CONCRETE_DEFINITION",
          "SECONDARY_TRANSCRIPTION"
        ],
        "status": "REVIEW_REQUIRED"
      },
      "attribution": [
        "Zura Kakushadze"
      ],
      "code_url": "https://github.com/wukan1986/ta_cn/blob/a569a618109daa804541c5d67fa4c0407f03fd49/ta_cn/alphas/alpha101.py#L642",
      "license": "MIT (community repository); upstream formula/paper rights not cleared",
      "locator": "line 80; Alpha80",
      "name": "WorldQuant Alpha080",
      "native_id": "alpha080",
      "paper": {
        "permission": "REVIEW_REQUIRED",
        "title": "101 Formulaic Alphas",
        "url": "https://arxiv.org/abs/1601.00991v3",
        "year": 2016
      },
      "parameters": {
        "alpha_number": 80,
        "numeric_literals": [
          "0.868128",
          "1",
          "4.04545",
          "5.11456",
          "5.53756"
        ],
        "operators": [
          "wq101:corr",
          "wq101:cs_rank",
          "wq101:delta",
          "wq101:industry_neutralize",
          "wq101:sign",
          "wq101:ts_rank"
        ],
        "source_commented_out": false
      },
      "primary_source": false,
      "record_id": "qkg:record:1cd68606-ad86-50f6-a0da-5941b9a5ccac",
      "response_sha256": "0fbc43addd022bab9b0ad935d30633c8b76645c38df98b7ee26f2579938e9207",
      "retrieved_at": "2026-09-25T12:03:09.101138+00:00",
      "revision": "0cd963d8780a3ad816dd5940fc4bc3f5e78ed09e",
      "rights": {
        "attribution_required": null,
        "commercial_use": "REVIEW_REQUIRED",
        "derivative_allowed": "REVIEW_REQUIRED",
        "license": "MIT (community repository); upstream formula/paper rights not cleared",
        "license_id": "qkg:license:5765226c-308b-51af-808c-bde9972fb0a3",
        "raw_data_allowed": "REVIEW_REQUIRED",
        "redistribution_allowed": "REVIEW_REQUIRED",
        "rights_scope": "Collected definitions/metadata only; excludes underlying market observations and upstream third-party rights.",
        "rights_status": "REVIEW_REQUIRED",
        "terms_url": "https://github.com/wukan1986/alpha_examples/blob/0cd963d8780a3ad816dd5940fc4bc3f5e78ed09e/LICENSE"
      },
      "sha256": "0fbc43addd022bab9b0ad935d30633c8b76645c38df98b7ee26f2579938e9207",
      "source_id": "wq101",
      "source_name": "WorldQuant Alpha101 (MIT community transcription)",
      "url": "https://github.com/wukan1986/alpha_examples/blob/0cd963d8780a3ad816dd5940fc4bc3f5e78ed09e/transformer/alpha101.txt"
    }
  ]
}
