{
  "admission": {
    "membership": {
      "curated": true,
      "historical_public_export": true
    },
    "reasons": [],
    "scope": "Existing definition admission only; not economic validity, execution readiness or commercial clearance.",
    "status": "ADMITTED"
  },
  "category": "technical_price_volume",
  "definition": {
    "content_origin": "OFFICIAL_GENERATED_CONFIGURATION",
    "definition_sha256": "e959973a6f1b32dfb045ae29e15b14f496a2028caaf4c84bed2e59d3866ce28f",
    "formula": "Ref($high, 18)/$close",
    "formula_dialect": "qlib",
    "formula_sha256": "e959973a6f1b32dfb045ae29e15b14f496a2028caaf4c84bed2e59d3866ce28f",
    "hash_scope": "SHA-256 of the original collected field UTF-8, before excerpting; null means absent.",
    "parameters": {
      "generator_default_config": true,
      "numeric_literals": [
        "18"
      ],
      "operators": [
        "qlib:delay"
      ],
      "unit": "trading_bars",
      "window_or_lag": 18
    },
    "required_fields": [
      "close",
      "high"
    ],
    "required_fields_status": "syntax_extracted_unexpanded",
    "status": "FORMULA_AVAILABLE",
    "text": "由已采集的 Qlib 官方配置展开而来；输入字段、窗口和算子按来源记录保留。",
    "truncated": false
  },
  "domain": {
    "asset_class": "equity",
    "frequency": "daily",
    "holding_period": null,
    "lookback": null,
    "rebalance": null,
    "universe": "configurable equity universe; no fixed market assumed"
  },
  "entity_type": "factor",
  "identity": {
    "curated_canonical_factor_id": "qkg:concept:4cf538ad-1c38-5445-b78c-23f45bceaebb",
    "equivalence_scope": "Existing exact-variant identity only; no new cross-source or economic-concept equivalence asserted.",
    "legacy_canonical_factor_ids": [
      "qkg:factor:02912b54-1797-5f74-9a57-9d6f8e0d1dad"
    ],
    "normalized_canonical_factor_ids": [
      "qkg:concept:4cf538ad-1c38-5445-b78c-23f45bceaebb"
    ],
    "normalized_concept_ids": [
      "qkg:concept:4cf538ad-1c38-5445-b78c-23f45bceaebb"
    ],
    "source_record_ids": [
      "qkg:record:aa5db59a-28bc-512b-bf96-ae82c5bdf19f"
    ]
  },
  "identity_namespace": "quantgraph/factor-variant",
  "missing_information": [
    "现有采集未验证计算语义；不代表已复现、可回测或具有收益有效性。",
    "行情供应商、历史可用时点、复权、缺失处理和实际组合交易规则尚未冻结。",
    "底层行情、原论文和研报授权分别核验，不从仓库代码许可推定。"
  ],
  "name": "HIGH18",
  "native_source_ids": [
    "Alpha360:HIGH18"
  ],
  "provenance": {
    "exporter": "factor-metadata-export/v1",
    "line_hash_scope": "Original UTF-8 JSONL line bytes, excluding the line terminator.",
    "source_artifact": "normalized/factor_records.jsonl",
    "source_lines": [
      {
        "line_bytes": 3578,
        "line_ordinal": 162,
        "line_sha256": "84ecb20936e16928e881f81c5895b072acec572b430ac24f7d9d814fddeae243",
        "record_id": "qkg:record:aa5db59a-28bc-512b-bf96-ae82c5bdf19f"
      }
    ],
    "source_snapshot_sha256": "58772a1fa216e8c26df4a049a1f7f818e6557bd648e2c53d971e5ba904835686"
  },
  "quality": {
    "backtest_ready": false,
    "economic_validity": "NOT_EVALUATED",
    "metadata_status": "IMPORTED_TRACEABLE_METADATA",
    "parse_status": [
      "parsed"
    ],
    "semantic_status": [
      "not_verified"
    ],
    "source_quality_tiers": [
      "primary_definition"
    ],
    "upstream_code_executed_in_export": false
  },
  "record_id": "qkg:factor:02912b54-1797-5f74-9a57-9d6f8e0d1dad",
  "record_kind": "signal",
  "rights": {
    "attribution_required": true,
    "commercial_use": [
      "ALLOWED"
    ],
    "derivative_allowed": [
      "ALLOWED"
    ],
    "license_labels": [
      "MIT"
    ],
    "license_notice": "README.md 中说明逐来源归属与限制；原状态保留，不因进入统一目录而放宽商业许可。",
    "market_observations_included": false,
    "raw_data_allowed": [
      "REVIEW_REQUIRED"
    ],
    "redistribution_allowed": [
      "ALLOWED"
    ],
    "scope": "Directory metadata and expressly identified definition excerpts only; no blanket license over upstream papers, source implementations or market observations.",
    "source_fulltext_included": false
  },
  "schema_version": "quantgraph-factor-metadata/v1",
  "sources": [
    {
      "admission": {
        "reasons": [],
        "status": "ADMITTED"
      },
      "attribution": [],
      "code_url": "https://github.com/microsoft/qlib/blob/be725493eb1a6bbb42bf11b37aa7669f59610ff1/qlib/contrib/data/loader.py#L16",
      "license": "MIT",
      "locator": "Alpha360DL.get_feature_config; feature=HIGH18",
      "name": "HIGH18",
      "native_id": "Alpha360:HIGH18",
      "paper": {
        "permission": "REVIEW_REQUIRED",
        "title": null,
        "url": null,
        "year": null
      },
      "parameters": {
        "generator_default_config": true,
        "numeric_literals": [
          "18"
        ],
        "operators": [
          "qlib:delay"
        ],
        "unit": "trading_bars",
        "window_or_lag": 18
      },
      "primary_source": true,
      "record_id": "qkg:record:aa5db59a-28bc-512b-bf96-ae82c5bdf19f",
      "response_sha256": "814b7f7ab3d418ae3c87ce352220080b239eba2670eac9e38376b794be4075cb",
      "retrieved_at": "2026-09-25T12:03:09.101138+00:00",
      "revision": "be725493eb1a6bbb42bf11b37aa7669f59610ff1",
      "rights": {
        "attribution_required": true,
        "commercial_use": "ALLOWED",
        "derivative_allowed": "ALLOWED",
        "license": "MIT",
        "license_id": "qkg:license:4fbc3e79-18c4-529e-80f1-306fda5c1b93",
        "raw_data_allowed": "REVIEW_REQUIRED",
        "redistribution_allowed": "ALLOWED",
        "rights_scope": "Collected definitions/metadata only; excludes underlying market observations and upstream third-party rights.",
        "rights_status": "ATTRIBUTION_REQUIRED",
        "terms_url": "https://github.com/microsoft/qlib/blob/be725493eb1a6bbb42bf11b37aa7669f59610ff1/LICENSE"
      },
      "sha256": "814b7f7ab3d418ae3c87ce352220080b239eba2670eac9e38376b794be4075cb",
      "source_id": "qlib",
      "source_name": "Microsoft Qlib",
      "url": "https://github.com/microsoft/qlib/blob/be725493eb1a6bbb42bf11b37aa7669f59610ff1/qlib/contrib/data/loader.py"
    }
  ]
}
