{
  "admission": {
    "membership": {
      "curated": true,
      "historical_public_export": false
    },
    "reasons": [],
    "scope": "Existing definition admission only; not economic validity, execution readiness or commercial clearance.",
    "status": "ADMITTED"
  },
  "category": "unclassified",
  "definition": {
    "content_origin": "ATTRIBUTED_SOURCE_DEFINITION_EXCERPT",
    "definition_sha256": "817f1f50bdf16186792a4bf26ab8be7b9269e23590149e7aec8fbf1fc4b20494",
    "formula": null,
    "formula_dialect": null,
    "formula_sha256": null,
    "hash_scope": "SHA-256 of the original collected field UTF-8, before excerpting; null means absent.",
    "parameters": {
      "accounting_availability_lag_months": 4,
      "core_153": true,
      "original_sign": "1",
      "source_occurrences": [],
      "theme": "Profit Growth"
    },
    "required_fields": [
      "CHG\\_TO\\_EXP",
      "INV",
      "SALE"
    ],
    "required_fields_status": "partial_latex_token_extraction",
    "status": "DEFINITION_EXCERPT",
    "text": "$ CHG\\_TO\\_EXP(SALE\\mbox{*}_t) - CHG\\_TO\\_EXP(INV_t)$",
    "truncated": false
  },
  "domain": {
    "asset_class": "equity",
    "frequency": "monthly",
    "holding_period": {
      "scope": "default JKP monthly factor portfolio",
      "unit": "month",
      "value": 1
    },
    "lookback": null,
    "rebalance": "monthly for default monthly JKP portfolios",
    "universe": "global equities; source covers 93 countries; country-specific data availability"
  },
  "entity_type": "factor",
  "identity": {
    "curated_canonical_factor_id": "qkg:concept:6428da76-d612-58ea-8ab1-cbbb952f8c57",
    "equivalence_scope": "Existing exact-variant identity only; no new cross-source or economic-concept equivalence asserted.",
    "legacy_canonical_factor_ids": [
      "qkg:factor:12d4e3eb-fdd3-53e2-8329-3dee4ae977b2"
    ],
    "normalized_canonical_factor_ids": [
      "qkg:concept:6428da76-d612-58ea-8ab1-cbbb952f8c57"
    ],
    "normalized_concept_ids": [
      "qkg:concept:6428da76-d612-58ea-8ab1-cbbb952f8c57"
    ],
    "source_record_ids": [
      "qkg:record:3834a77f-e8de-521c-8aeb-2183b934f9a5"
    ]
  },
  "identity_namespace": "quantgraph/factor-variant",
  "missing_information": [
    "现有采集未验证计算语义；不代表已复现、可回测或具有收益有效性。",
    "行情供应商、历史可用时点、复权、缺失处理和实际组合交易规则尚未冻结。",
    "底层行情、原论文和研报授权分别核验，不从仓库代码许可推定。",
    "输入字段提取不完整，不得视为完整数据需求合同。"
  ],
  "name": "Change Sales minus Change Inventory",
  "native_source_ids": [
    "dsale_dinv"
  ],
  "provenance": {
    "exporter": "factor-metadata-export/v1",
    "line_hash_scope": "Original UTF-8 JSONL line bytes, excluding the line terminator.",
    "source_artifact": "normalized/factor_records.jsonl",
    "source_lines": [
      {
        "line_bytes": 3740,
        "line_ordinal": 971,
        "line_sha256": "a892f79f23b1ed7a06d7fc4ad4a340a7bbc7fc1f9f693c4c20b6b53ed97ce169",
        "record_id": "qkg:record:3834a77f-e8de-521c-8aeb-2183b934f9a5"
      }
    ],
    "source_snapshot_sha256": "58772a1fa216e8c26df4a049a1f7f818e6557bd648e2c53d971e5ba904835686"
  },
  "quality": {
    "backtest_ready": false,
    "economic_validity": "NOT_EVALUATED",
    "metadata_status": "IMPORTED_TRACEABLE_METADATA",
    "parse_status": [
      "not_applicable"
    ],
    "semantic_status": [
      "not_verified"
    ],
    "source_quality_tiers": [
      "primary_definition"
    ],
    "upstream_code_executed_in_export": false
  },
  "record_id": "qkg:factor:12d4e3eb-fdd3-53e2-8329-3dee4ae977b2",
  "record_kind": "signal",
  "rights": {
    "attribution_required": true,
    "commercial_use": [
      "PROHIBITED"
    ],
    "derivative_allowed": [
      "CONDITIONAL"
    ],
    "license_labels": [
      "CC-BY-NC-4.0 (reference metadata; conservative scope); MIT (code)"
    ],
    "license_notice": "README.md 中说明逐来源归属与限制；原状态保留，不因进入统一目录而放宽商业许可。",
    "market_observations_included": false,
    "raw_data_allowed": [
      "REVIEW_REQUIRED"
    ],
    "redistribution_allowed": [
      "CONDITIONAL"
    ],
    "scope": "Directory metadata and expressly identified definition excerpts only; no blanket license over upstream papers, source implementations or market observations.",
    "source_fulltext_included": false
  },
  "schema_version": "quantgraph-factor-metadata/v1",
  "sources": [
    {
      "admission": {
        "reasons": [],
        "status": "ADMITTED"
      },
      "attribution": [
        "Abarbanell, Jeffery S",
        "Bushee, Brian J"
      ],
      "code_url": "https://github.com/bkelly-lab/jkp-data/blob/666e8960ed81a664f1e9f189f92925ab2eeffcd5/src/jkp/data/aux_functions.py",
      "license": "CC-BY-NC-4.0 (reference metadata; conservative scope); MIT (code)",
      "locator": "documentation.tex:L1861",
      "name": "Change Sales minus Change Inventory",
      "native_id": "dsale_dinv",
      "paper": {
        "permission": "REVIEW_REQUIRED",
        "title": "Abnormal returns to a fundamental analysis strategy",
        "url": null,
        "year": 1998
      },
      "parameters": {
        "accounting_availability_lag_months": 4,
        "core_153": true,
        "original_sign": "1",
        "source_occurrences": [],
        "theme": "Profit Growth"
      },
      "primary_source": true,
      "record_id": "qkg:record:3834a77f-e8de-521c-8aeb-2183b934f9a5",
      "response_sha256": "a987f4876e80a21f8712e208818361c81f011e25259a3f7575cee49806b34801",
      "retrieved_at": "2026-09-25T12:03:09.101138+00:00",
      "revision": "666e8960ed81a664f1e9f189f92925ab2eeffcd5",
      "rights": {
        "attribution_required": true,
        "commercial_use": "PROHIBITED",
        "derivative_allowed": "CONDITIONAL",
        "license": "CC-BY-NC-4.0 (reference metadata; conservative scope); MIT (code)",
        "license_id": "qkg:license:debe6add-b9c3-5468-a3f1-47f1ae88c9d1",
        "raw_data_allowed": "REVIEW_REQUIRED",
        "redistribution_allowed": "CONDITIONAL",
        "rights_scope": "Collected definitions/metadata only; excludes underlying market observations and upstream third-party rights.",
        "rights_status": "NONCOMMERCIAL_ONLY",
        "terms_url": "https://github.com/bkelly-lab/jkp-data/blob/666e8960ed81a664f1e9f189f92925ab2eeffcd5/DATA_LICENSE"
      },
      "sha256": "a987f4876e80a21f8712e208818361c81f011e25259a3f7575cee49806b34801",
      "source_id": "jkp",
      "source_name": "JKP Global Factor Data",
      "url": "https://github.com/bkelly-lab/jkp-data/blob/666e8960ed81a664f1e9f189f92925ab2eeffcd5/documentation/documentation.tex"
    }
  ]
}
